Date/Time,Picture,Description,Location
"Jun 12th 10:30 am to 11:30 am", "greet.jpg", "Join us for an introduction to the team!", "Davis Center, Room 25"
"July 6th 10:00 am to 2:00 pm", "bake.jpg", "Help us sell delicious pastries and ice cream!", "Robert Hall, 35th Street, Burlington"
"July 12th 1:00 pm to 4:00 pm", "wedding.jpg", "Congratulations to Okonkwo and Ezinma!", "1029 Cool Avenue, South Burlington"
"July 22th 5:30 pm to 7:00 pm", "clothes.jpg", "Collect and give out clothing to those in need", "Davis Center, Room 25"
"August 3rd 4:00 pm to 5:00 pm", "meeting.jpg", "Just a monthly meeting to recap and plan", "Davis Center, Room 25"
"August 5th 1:00 pm to 3:00 pm", "yam.jpg", "Help us prepare, cook and enjoy delicious yam and chicken curry!", "First Baptist Church, 81 St Paul St # 1, Burlington"